[
  {
    "schema_version": 1,
    "id": "bacon-cheeseburger-sliders",
    "title": "Bacon Cheeseburger Sliders — Thin Patties",
    "recipe_type": "full_dish",
    "tags": [
      "sliders",
      "beef",
      "bacon"
    ],
    "standardization": {
      "description": "12 Hawaiian-roll sliders (two thin oversized beef slabs)",
      "scale_basis": {
        "ingredient_id": "hawaiian-rolls",
        "quantity": 12,
        "unit": "each"
      }
    },
    "time": {
      "prep_minutes": 20,
      "inactive_minutes": 0,
      "cook_minutes": 20,
      "total_minutes": 40
    },
    "yield_info": {
      "servings": 12,
      "finished_weight_g": null,
      "finished_weight_status": "unknown"
    },
    "nutrition": {
      "total_carbs_g": null,
      "carb_type": "total",
      "estimate_quality": "not_calculated",
      "calculation": "Pending confirmed brands, weights, and quantities"
    },
    "ingredients": [
      {
        "id": "hawaiian-rolls",
        "name": "Hawaiian rolls",
        "quantity": 12,
        "unit": "each",
        "preparation": null,
        "scale_mode": "proportional",
        "optional": false,
        "quantity_origin": "reconstructed_default"
      },
      {
        "id": "ground-beef",
        "name": "80/20 ground beef",
        "quantity": 1.5,
        "unit": "lb",
        "preparation": null,
        "scale_mode": "proportional",
        "optional": false,
        "quantity_origin": "reconstructed_default"
      },
      {
        "id": "cooked-bacon",
        "name": "Bacon",
        "quantity": 12,
        "unit": "slice",
        "preparation": null,
        "scale_mode": "proportional",
        "optional": false,
        "quantity_origin": "reconstructed_default"
      },
      {
        "id": "sliced-cheese",
        "name": "Cheddar slices",
        "quantity": 6,
        "unit": "slice",
        "preparation": null,
        "scale_mode": "proportional",
        "optional": false,
        "quantity_origin": "reconstructed_default"
      },
      {
        "id": "kosher-salt",
        "name": "Diamond Crystal kosher salt",
        "quantity": 1,
        "unit": "tsp",
        "preparation": null,
        "scale_mode": "proportional",
        "optional": false,
        "quantity_origin": "reconstructed_default"
      },
      {
        "id": "black-pepper",
        "name": "Black pepper",
        "quantity": 0.5,
        "unit": "tsp",
        "preparation": null,
        "scale_mode": "proportional",
        "optional": false,
        "quantity_origin": "reconstructed_default"
      },
      {
        "id": "butter-topping",
        "name": "Butter for roll tops",
        "quantity": 1,
        "unit": "tbsp",
        "preparation": null,
        "scale_mode": "proportional",
        "optional": true,
        "quantity_origin": "reconstructed_default"
      }
    ],
    "phases": [
      {
        "id": "prepare-ahead",
        "name": "Prepare ahead",
        "steps": [
          {
            "id": "bacon-cheeseburger-sliders-p1-s1",
            "instruction": "Cook bacon until crisp and drain on paper towels. Keep chilled if assembling well ahead.",
            "ingredient_uses": [
              {
                "ingredient_id": "cooked-bacon"
              }
            ],
            "time_minutes": 12,
            "temperature_f": null,
            "source_status": "reconstructed"
          },
          {
            "id": "bacon-cheeseburger-sliders-p1-s2",
            "instruction": "For each connected sheet of rolls, shape two thin, wide beef slabs slightly larger than the sheet (to allow shrinkage). Season both sides just before cooking.",
            "ingredient_uses": [
              {
                "ingredient_id": "ground-beef"
              },
              {
                "ingredient_id": "kosher-salt"
              },
              {
                "ingredient_id": "black-pepper"
              }
            ],
            "time_minutes": 7,
            "temperature_f": null,
            "source_status": "reconstructed"
          },
          {
            "id": "bacon-cheeseburger-sliders-p1-s3",
            "instruction": "Sear slabs on a large griddle or skillet over medium-high heat until browned and the ground beef reaches 160°F; work in batches if needed.",
            "ingredient_uses": [
              {
                "ingredient_id": "ground-beef"
              }
            ],
            "time_minutes": 8,
            "temperature_f": null,
            "source_status": "reconstructed"
          }
        ]
      },
      {
        "id": "assemble-and-finish",
        "name": "Assemble and finish",
        "steps": [
          {
            "id": "bacon-cheeseburger-sliders-p2-s1",
            "instruction": "Split each connected sheet of rolls horizontally. Layer both beef slabs, the cooked bacon and cheese on the bottom half. Replace roll tops.",
            "ingredient_uses": [
              {
                "ingredient_id": "hawaiian-rolls"
              },
              {
                "ingredient_id": "ground-beef"
              },
              {
                "ingredient_id": "cooked-bacon"
              },
              {
                "ingredient_id": "sliced-cheese"
              }
            ],
            "time_minutes": 5,
            "temperature_f": null,
            "source_status": "reconstructed"
          },
          {
            "id": "bacon-cheeseburger-sliders-p2-s2",
            "instruction": "Optionally brush tops with melted butter. Bake at 350°F until the cheese melts and rolls are hot, about 8–12 minutes. Slice into individual sliders.",
            "ingredient_uses": [
              {
                "ingredient_id": "butter-topping"
              }
            ],
            "time_minutes": 10,
            "temperature_f": 350,
            "source_status": "reconstructed"
          }
        ]
      }
    ],
    "notes": [
      "Bacon is cooked separately and layered, not mixed raw into beef. The two slab patties were a proposed smash-style approach; slab dimensions depend on the roll sheet.",
      "Make-ahead: cook components earlier, refrigerate promptly; reheat assembled sliders until piping hot.",
      "Recipe-editor note: some ingredient quantities were filled in or normalized for practical cooking and are identified by quantity_origin in JSON; they were not all recovered verbatim from the original chat."
    ],
    "history_notes": [],
    "provenance": {
      "status": "historical_conversation_plus_editorial_reconstruction",
      "source": "Existing Kitchen Notes historical archive; quantities absent from archive estimated for practical cooking",
      "review_status": "editorial_defaults_not_tested",
      "quantity_policy": "Existing archive quantities retained unless documented in editorial changes; reconstructed amounts explicitly labeled by ingredient."
    }
  },
  {
    "schema_version": 1,
    "id": "baked-french-toast",
    "title": "Baked French Toast — Quick or Overnight",
    "recipe_type": "full_dish",
    "tags": [
      "breakfast",
      "baking",
      "make-ahead"
    ],
    "standardization": {
      "description": "Two-loaf batch; compatible with 60/40 quick/overnight split",
      "scale_basis": {
        "ingredient_id": "brioche-or-challah",
        "quantity": 2,
        "unit": "loaf"
      }
    },
    "time": {
      "prep_minutes": 25,
      "inactive_minutes": 60,
      "cook_minutes": 50,
      "total_minutes": 135
    },
    "yield_info": {
      "servings": 14,
      "finished_weight_g": null,
      "finished_weight_status": "unknown"
    },
    "nutrition": {
      "total_carbs_g": null,
      "carb_type": "total",
      "estimate_quality": "not_calculated",
      "calculation": "Pending confirmed brands, weights, and quantities"
    },
    "ingredients": [
      {
        "id": "brioche-or-challah",
        "name": "Brioche or challah",
        "quantity": 2,
        "unit": "loaf",
        "preparation": "day-old, cubed",
        "scale_mode": "proportional",
        "optional": false,
        "quantity_origin": "existing_archive"
      },
      {
        "id": "eggs",
        "name": "Large eggs",
        "quantity": 10,
        "unit": "each",
        "preparation": null,
        "scale_mode": "proportional",
        "optional": false,
        "quantity_origin": "reconstructed_default"
      },
      {
        "id": "milk",
        "name": "Whole milk",
        "quantity": 3,
        "unit": "cup",
        "preparation": null,
        "scale_mode": "proportional",
        "optional": false,
        "quantity_origin": "reconstructed_default"
      },
      {
        "id": "cream",
        "name": "Heavy cream",
        "quantity": 1,
        "unit": "cup",
        "preparation": null,
        "scale_mode": "proportional",
        "optional": false,
        "quantity_origin": "reconstructed_default"
      },
      {
        "id": "sugar",
        "name": "Granulated sugar",
        "quantity": 0.5,
        "unit": "cup",
        "preparation": null,
        "scale_mode": "proportional",
        "optional": false,
        "quantity_origin": "reconstructed_default"
      },
      {
        "id": "vanilla",
        "name": "Vanilla extract",
        "quantity": 2,
        "unit": "tbsp",
        "preparation": null,
        "scale_mode": "proportional",
        "optional": false,
        "quantity_origin": "reconstructed_default"
      },
      {
        "id": "cinnamon",
        "name": "Ground cinnamon",
        "quantity": 2,
        "unit": "tsp",
        "preparation": null,
        "scale_mode": "proportional",
        "optional": false,
        "quantity_origin": "reconstructed_default"
      },
      {
        "id": "nuts-optional-topping",
        "name": "Chopped walnuts or pecans",
        "quantity": 1,
        "unit": "cup",
        "preparation": null,
        "scale_mode": "proportional",
        "optional": true,